{
	"definitions": {
		"contribution": {
			"$schema": "http://json-schema.org/draft-06/schema#",
			"id": "http://adaptivecards.io/schemas/adaptive-card.json",
			"definitions": {
				"Class": {
					"description": "Expresses a class",
					"properties": {
						"classType": {
							"enum": [
								"Class"
							],
							"description": "Must be `Class`"
						},
						"type": {
							"type": "string",
							"description": "The name of the class"
						},
						"description": {
							"type": "string",
							"description": "A description of the class"
						},
						"properties": {
							"type": "object",
							"additionalProperties": {
								"$ref": "#/definitions/Property"
							},
							"description": "Properties of the class"
						},
						"isAbstract": {
							"type": "boolean",
							"description": "Specifies whether this class is abstract"
						},
						"extends": {
							"type": "string",
							"description": "Class that this class extends from"
						},
						"shorthand": {
							"type": "string",
							"description": "Name of one of the properties that represents a shorthand version of this class"
						},
						"$schema": {
							"type": "string",
							"format": "uri",
							"description": "JSON schema for the JSON file"
						}
					},
					"type": "object",
					"additionalProperties": false,
					"required": []
				},
				"Enum": {
					"description": "Expresses an enum",
					"properties": {
						"classType": {
							"enum": [
								"Enum"
							],
							"description": "Must be `Enum`"
						},
						"type": {
							"type": "string",
							"description": "The name of the enum"
						},
						"values": {
							"type": "array",
							"items": {
								"$ref": "#/definitions/EnumValue"
							},
							"description": "The values in the enum"
						},
						"$schema": {
							"type": "string",
							"format": "uri",
							"description": "JSON schema for the JSON file"
						}
					},
					"type": "object",
					"additionalProperties": false,
					"required": [
						"type",
						"values"
					]
				},
				"EnumValue": {
					"description": "Expresses an enum value",
					"anyOf": [
						{
							"type": "string",
							"description": "The name of the enum value"
						},
						{
							"type": "object",
							"properties": {
								"classType": {
									"enum": [
										"EnumValue"
									],
									"description": "Must be `EnumValue`"
								},
								"value": {
									"type": "string",
									"description": "The name of the enum value"
								},
								"description": {
									"type": "string",
									"description": "A description of the enum value"
								}
							},
							"required": [
								"value"
							],
							"additionalProperties": false
						}
					]
				},
				"Property": {
					"properties": {
						"classType": {
							"enum": [
								"Property"
							],
							"description": "Must be `Property`"
						},
						"type": {
							"type": "string",
							"description": "The type of the property"
						},
						"description": {
							"type": "string",
							"description": "A description of the property"
						},
						"version": {
							"type": "string",
							"description": "The version when the property is introduced"
						},
						"required": {
							"type": "boolean",
							"description": "Specifies whether the property is required",
							"default": false
						},
						"shorthands": {
							"type": "array",
							"items": {
								"$ref": "#/definitions/Property"
							},
							"description": "Shorthand alternatives for this property"
						},
						"default": {
							"description": "The default value of this property"
						},
						"examples": {
							"type": "array",
							"description": "Examples of this value"
						}
					},
					"type": "object",
					"additionalProperties": false,
					"required": [
						"type"
					]
				}
			},
			"anyOf": [
				{
					"allOf": [
						{
							"$ref": "#/definitions/Class"
						}
					]
				},
				{
					"allOf": [
						{
							"$ref": "#/definitions/Enum"
						}
					],
					"required": [
						"classType"
					]
				}
			]
		}
	},
	"$schema": "http://json-schema.org/draft-07/schema#",
	"$id": "https://example.com/object1619001505.json",
	"title": "Root",
	"type": "object",
	"required": [
		"id",
		"version",
		"supports",
		"contributes"
	],
	"properties": {
		"id": {
			"type": "string",
			"examples": [
				"check-digit"
			]
		},
		"version": {
			"type": "string",
			"examples": [
				"0.1"
			]
		},
		"elementPrefix": {
			"type": "string",
			"default": "",
			"examples": [
				"asseco"
			]
		},
		"propertyPrefix": {
			"type": "string",
			"default": "",
			"examples": [
				"asseco"
			]
		},
		"supports": {
			"type": "object"
		},
		"contributes": {
			"type": "object",
			"required": [
				"definitions"
			],
			"properties": {
				"definitions": {
					"type": "object",
					"additionalProperties": {
						"$ref": "#/definitions/contribution"
					}
				}
			},
			"hostConfig": {
				"type": "object",
				"required": [
					"properties"
				],
				"properties": {
					"properties": {
						"type": "object"
					}
				}
			}
		}
	}
}