{
  "id": "autocomplete",
  "version": "0.1",
  "elementPrefix": "aseeco",
  "propertyPrefix": "",
  "supports": {
    "javascript": "https://npmjs.com/package/adaptivecards-autocomplete"
  },
  "contributes": {
    "definitions": {
      "AutocompleteChoice": {
        "properties": {
          "value": {
            "type": "string",
            "description": "Value for autocomplete choice.",
            "version": "0.1"
          }
        }
      },
      "Input.Autocomplete": {
        "description": "Allows a user to input text with autocomplete option.",
        "properties": {
          "id": {
            "type": "string",
            "description": "Unique identifier for the value. Used to identify collected input when the Submit action is performed.",
            "version": "0.1"
          },
          "value": {
            "type": "string",
            "description": "Initial value that should be selected.",
            "version": "0.1"
          },
          "choices": {
            "type": "AutocompleteChoice[]",
            "description": "Autocomplete choices.",
            "version": "0.1"
          },
          "placeholder": {
            "type": "string",
            "description": "Description of the input desired. Only visible when no selection has been made.",
            "version": "0.1"
          },
          "dataSource": {
            "type": "DataSource",
            "description": "DataSource is an abstraction for using local data (arrays of JavaScript objects) or remote data (web services returning JSON or XML).",
            "version": "0.1"
          }
        }
      }
    }
  }
}