{
    "id": "test",
    "version": "0.1",
    "elementPrefix": "dp",
    "propertyPrefix": "",
    "supports": {
        "javascript": "https://npmjs.com/package/adaptivecards-autocomplete"
    },
    "contributes": {
        "definitions": {
            "Test": {
                "description": "Allows a user to input a Chip.",
                "properties": {
                    "type": {
                        "type": "string",
                        "enum": ["Test"],
                        "description": "Must be `Test`"
                    },
                    "value": {
                        "type": "string",
                        "description": "The initial choice (or set of chips) that should be selected. For multi-select, specify a comma-separated string of values.",
                        "version": "0.1"
                    },
                    "placeholder": {
                        "type": "string",
                        "description": "Description of the input desired. Only visible when no selection has been made, the `style` is `compact` and `isMultiSelect` is `false`",
                        "version": "0.1"
                    },
                    "color": {
                        "type": "string",
                        "description": "Material color palette of chip. Initial is 'primary'.",
                        "version": "0.1"
                    },
                    "selectable": {
                        "type": "boolean",
                        "description": "Whether or not chips are selectable. Default is true.",
                        "version": "0.1"
                    },
                    "removable": {
                        "type": "boolean",
                        "description": "Whether or not chips are removable. Default is true.",
                        "version": "0.1"
                    },
                    "addOnBlur": {
                        "type": "boolean",
                        "description": "Whether or not the chipEnd event will be emitted when the input is blurred. Default is true.",
                        "version": "0.1"
                    }
                },
                "type": "object",
                "additionalProperties": false,
                "required": ["chips"],
                "extends": "Element"
            }
        }
    }
}
